{
  "$schema": "https://json-schema.org/draft/2020-12/schema",
  "type": "object",
  "additionalProperties": false,
  "required": [
    "schemaVersion",
    "unitsPerEm",
    "axis",
    "reference",
    "target"
  ],
  "properties": {
    "schemaVersion": {
      "const": 1
    },
    "unitsPerEm": {
      "type": "number",
      "minimum": 16,
      "maximum": 16384
    },
    "axis": {
      "type": "object",
      "additionalProperties": false,
      "required": [
        "tag",
        "locations"
      ],
      "properties": {
        "tag": {
          "type": "string",
          "minLength": 1,
          "maxLength": 64
        },
        "locations": {
          "type": "array",
          "items": {
            "type": "number"
          },
          "minItems": 2,
          "maxItems": 2
        }
      }
    },
    "reference": {
      "$ref": "#/$defs/master"
    },
    "target": {
      "$ref": "#/$defs/master"
    },
    "options": {
      "type": "object",
      "additionalProperties": false,
      "properties": {
        "referencePolicy": {
          "enum": [
            "fixed",
            "shared-subdivision"
          ]
        },
        "fitTolerance": {
          "type": "number",
          "exclusiveMinimum": 0
        },
        "contourPairs": {
          "type": "array",
          "items": {
            "type": "integer",
            "minimum": 0
          }
        },
        "startNodes": {
          "type": "array",
          "items": {
            "type": "integer",
            "minimum": -1
          }
        },
        "preserveStructure": {
          "type": "boolean"
        },
        "maxAdditionalOnCurveNodes": {
          "type": "integer",
          "minimum": 0,
          "maximum": 1024,
          "default": 0
        },
        "maxOnCurveNodes": {
          "type": "integer",
          "minimum": 3,
          "maximum": 1024,
          "default": 64
        },
        "maxNodes": {
          "type": "integer",
          "minimum": 3,
          "maximum": 4096,
          "default": 64
        }
      }
    }
  },
  "$defs": {
    "node": {
      "type": "object",
      "additionalProperties": false,
      "required": [
        "x",
        "y",
        "type",
        "smooth"
      ],
      "properties": {
        "x": {
          "type": "number"
        },
        "y": {
          "type": "number"
        },
        "type": {
          "enum": [
            "line",
            "curve",
            "offcurve"
          ]
        },
        "smooth": {
          "type": "boolean"
        }
      }
    },
    "contour": {
      "type": "object",
      "additionalProperties": false,
      "required": [
        "closed",
        "nodes"
      ],
      "properties": {
        "closed": {
          "const": true
        },
        "nodes": {
          "type": "array",
          "minItems": 2,
          "maxItems": 4096,
          "items": {
            "$ref": "#/$defs/node"
          }
        }
      }
    },
    "outline": {
      "type": "object",
      "additionalProperties": false,
      "required": [
        "contours"
      ],
      "properties": {
        "contours": {
          "type": "array",
          "minItems": 1,
          "maxItems": 64,
          "items": {
            "$ref": "#/$defs/contour"
          }
        }
      }
    },
    "master": {
      "type": "object",
      "additionalProperties": false,
      "required": [
        "id",
        "outline"
      ],
      "properties": {
        "id": {
          "type": "string",
          "minLength": 1,
          "maxLength": 255
        },
        "outline": {
          "$ref": "#/$defs/outline"
        }
      }
    }
  },
  "title": "beztrace matching request v1"
}
