{
  "axis": {
    "locations": [
      100,
      900
    ],
    "tag": "wght"
  },
  "options": {
    "contourPairs": [],
    "fitTolerance": 1,
    "referencePolicy": "shared-subdivision",
    "startNodes": [],
    "maxAdditionalOnCurveNodes": 4,
    "maxOnCurveNodes": 64
  },
  "reference": {
    "id": "Light",
    "outline": {
      "contours": [
        {
          "closed": true,
          "nodes": [
            {
              "smooth": false,
              "type": "line",
              "x": 0,
              "y": 0
            },
            {
              "smooth": false,
              "type": "line",
              "x": 100,
              "y": 0
            },
            {
              "smooth": false,
              "type": "line",
              "x": 100,
              "y": 200
            },
            {
              "smooth": false,
              "type": "line",
              "x": 0,
              "y": 200
            }
          ]
        }
      ]
    }
  },
  "schemaVersion": 1,
  "target": {
    "id": "Bold",
    "outline": {
      "contours": [
        {
          "closed": true,
          "nodes": [
            {
              "smooth": false,
              "type": "line",
              "x": 0,
              "y": 0
            },
            {
              "smooth": false,
              "type": "line",
              "x": 50,
              "y": -40
            },
            {
              "smooth": false,
              "type": "line",
              "x": 100,
              "y": 0
            },
            {
              "smooth": false,
              "type": "line",
              "x": 100,
              "y": 200
            },
            {
              "smooth": false,
              "type": "line",
              "x": 0,
              "y": 200
            }
          ]
        }
      ]
    }
  },
  "unitsPerEm": 1000
}
